Product ID,Product Name,Brand Link
287391459,Vet's Kitchen Pork & Potato 2.2Kg,https://www.tesco.com/groceries/en-GB/shop/pets/all?brand=Vets%20Kitchen&viewAll=brand&page=
312574540,Agriselect Wood Pellets Cat Litter 7L,https://www.tesco.com/groceries/en-GB/shop/pets/all?brand=Agriselect&viewAll=brand&page=
310671897,Core Supply Pet Licky Mat Assortment,https://www.tesco.com/groceries/en-GB/shop/pets/all?brand=Core%20Home&viewAll=brand&page=
310136509,Duerr's Peamutt Butter Peanut Butter For Dogs 340G,https://www.tesco.com/groceries/en-GB/shop/pets/all?brand=Duerr%27s&viewAll=brand&page=
308835324,Pascoes Tasty Chunks In Jelly 12X100g,https://www.tesco.com/groceries/en-GB/shop/pets/all?brand=Pascoe%27s&viewAll=brand&page=
310677329,Rosewood Pet Treat Toy Red,https://www.tesco.com/groceries/en-GB/shop/pets/all?brand=Rosewood&viewAll=brand&page=
311079727,Tesco Pet Toy Basket,https://www.tesco.com/groceries/en-GB/shop/pets/all?brand=Tesco%20Home&viewAll=brand&page=
260587673,Top Life Formula Puppy Milk 200Ml,https://www.tesco.com/groceries/en-GB/shop/pets/all?brand=Top%20Life&viewAll=brand&page=
295336318,Vanish Pet Expert Carpet Care Foam 600Ml,https://www.tesco.com/groceries/en-GB/shop/pets/all?brand=Vanish&viewAll=brand&page=
305835231,Bucktons Budgerigar Food Spiralife 500G,https://www.tesco.com/groceries/en-GB/shop/pets/all?brand=Westland&viewAll=brand&page=
308094036,Tesco Adult Chicken & Vegetables Dry Cat Food 2Kg,https://www.tesco.com/groceries/en-GB/shop/pets/all?brand=Tesco%20Pet&viewAll=brand&page=
262963985,Tesco Biscuit Bone Small Bite Selection 800G,https://www.tesco.com/groceries/en-GB/shop/pets/all?brand=Tesco%20Pet&viewAll=brand&page=
265754636,Tesco 12 Puppy Sausages Treats Beef 30G,https://www.tesco.com/groceries/en-GB/shop/pets/all?brand=Tesco%20Pet&viewAll=brand&page=
273674740,Tesco Tasty Treats 4 Small Log Bones With Chicken 180G,https://www.tesco.com/groceries/en-GB/shop/pets/all?brand=Tesco%20Pet&viewAll=brand&page=
263355119,Tesco 2 Filled Log Bone Dog Treats 200G,https://www.tesco.com/groceries/en-GB/shop/pets/all?brand=Tesco%20Pet&viewAll=brand&page=
286544270,Tesco Cat Sticks Treats Salmon & Trout 30G,https://www.tesco.com/groceries/en-GB/shop/pets/all?brand=Tesco%20Pet&viewAll=brand&page=
308087333,Tesco Adult Dog Loaf Selection 12 X 395G,https://www.tesco.com/groceries/en-GB/shop/pets/all?brand=Tesco%20Pet&viewAll=brand&page=
308464329,"Tesco Adult Dog Food Pate Selection Chicken, Beef & Lamb 12X150g",https://www.tesco.com/groceries/en-GB/shop/pets/all?brand=Tesco%20Pet&viewAll=brand&page=
308491319,Tesco Adult Cat Mixed Selection In Gravy 6X400g,https://www.tesco.com/groceries/en-GB/shop/pets/all?brand=Tesco%20Pet&viewAll=brand&page=
263422946,Tesco 28 Dental Sticks Medium Dog 720G,https://www.tesco.com/groceries/en-GB/shop/pets/all?brand=Tesco%20Pet&viewAll=brand&page=
308475064,Tesco Senior Cat 12X100g Fish Select In Jelly,https://www.tesco.com/groceries/en-GB/shop/pets/all?brand=Tesco%20Pet&viewAll=brand&page=
274746654,Tesco Chicken Cat Food Pate 100G,https://www.tesco.com/groceries/en-GB/shop/pets/all?brand=Tesco%20Pet&viewAll=brand&page=
308084935,Tesco Tasty Treats Pocket Pillows With Catnip 65G,https://www.tesco.com/groceries/en-GB/shop/pets/all?brand=Tesco%20Pet&viewAll=brand&page=
296983402,Tesco Large Meadow Hay Bedding 1.5Kg,https://www.tesco.com/groceries/en-GB/shop/pets/all?brand=Tesco%20Pet&viewAll=brand&page=
254906868,Tesco Beef & Country Vegetable Dry Dog Food 3Kg,https://www.tesco.com/groceries/en-GB/shop/pets/all?brand=Tesco%20Pet&viewAll=brand&page=
252757657,Tesco Biscuit Bones Large Bite Selection Dog Treats 1.2Kg,https://www.tesco.com/groceries/en-GB/shop/pets/all?brand=Tesco%20Pet&viewAll=brand&page=
307752135,Tesco Wild Bird Food Peanuts 1Kg,https://www.tesco.com/groceries/en-GB/shop/pets/all?brand=Tesco%20Pet&viewAll=brand&page=
274746988,Tesco Standard Pate With Salmon 100G,https://www.tesco.com/groceries/en-GB/shop/pets/all?brand=Tesco%20Pet&viewAll=brand&page=
308116594,Tesco Daily Dental 28 Large Dog Sticks 4X270g,https://www.tesco.com/groceries/en-GB/shop/pets/all?brand=Tesco%20Pet&viewAll=brand&page=
308481239,Tesco Adult Cat Pate With Turkey & Liver 100G,https://www.tesco.com/groceries/en-GB/shop/pets/all?brand=Tesco%20Pet&viewAll=brand&page=
308095909,Tesco Everyday Seed Mix 1Kg,https://www.tesco.com/groceries/en-GB/shop/pets/all?brand=Tesco%20Pet&viewAll=brand&page=
267704110,Tesco Dog Small Bite Mixer 1.8Kg,https://www.tesco.com/groceries/en-GB/shop/pets/all?brand=Tesco%20Pet&viewAll=brand&page=
308093129,Tesco Kitten Chicken & Rice Dry Food 1Kg,https://www.tesco.com/groceries/en-GB/shop/pets/all?brand=Tesco%20Pet&viewAll=brand&page=
307338223,Tesco Wild Bird Everyday Seed Mix 4Kg,https://www.tesco.com/groceries/en-GB/shop/pets/all?brand=Tesco%20Pet&viewAll=brand&page=
307736506,Good Boy Wagtastic Assorted Meat Strips 300G,https://www.tesco.com/groceries/en-GB/shop/pets/all?brand=Good%20Boy&viewAll=brand&page=
309747202,Good Boy Tough & Tasty Chicken Large Roll 80G,https://www.tesco.com/groceries/en-GB/shop/pets/all?brand=Good%20Boy&viewAll=brand&page=
309764187,Good Boy Wagtastic Light Up Snowball Toy,https://www.tesco.com/groceries/en-GB/shop/pets/all?brand=Good%20Boy&viewAll=brand&page=
306953233,Good Boy Hug Tug Reindeer Dog Toy,https://www.tesco.com/groceries/en-GB/shop/pets/all?brand=Good%20Boy&viewAll=brand&page=
306933637,Good Boy Wagtastic Moppy Robin Dog Toy,https://www.tesco.com/groceries/en-GB/shop/pets/all?brand=Good%20Boy&viewAll=brand&page=
309460143,Good Boy Wagtastic Real Meat Dog Stocking,https://www.tesco.com/groceries/en-GB/shop/pets/all?brand=Good%20Boy&viewAll=brand&page=
306665804,Good Boy Chewy Chicken Nibbles Dog Treats 70G,https://www.tesco.com/groceries/en-GB/shop/pets/all?brand=Good%20Boy&viewAll=brand&page=
306955732,Good Boy Treats Festive Beef Wellington 70G,https://www.tesco.com/groceries/en-GB/shop/pets/all?brand=Good%20Boy&viewAll=brand&page=
309788239,Good Boy Tough & Tasty Chicken Chomp Stix Treats 60G,https://www.tesco.com/groceries/en-GB/shop/pets/all?brand=Good%20Boy&viewAll=brand&page=
311939508,Good Boy Dog Treats Chicken & Broccoli 100G,https://www.tesco.com/groceries/en-GB/shop/pets/all?brand=Good%20Boy&viewAll=brand&page=
311783789,Good Boy Mini Chicken Dog Treats 60G,https://www.tesco.com/groceries/en-GB/shop/pets/all?brand=Good%20Boy&viewAll=brand&page=
306649605,Good Boy Meaty Variety Pack Dog Treats 70G,https://www.tesco.com/groceries/en-GB/shop/pets/all?brand=Good%20Boy&viewAll=brand&page=
298872755,Wagtastic Toy Squeaky Donut Dog Toy,https://www.tesco.com/groceries/en-GB/shop/pets/all?brand=Good%20Boy&viewAll=brand&page=
306661987,Good Boy Chicken Variety Pack Dog Treats 70G,https://www.tesco.com/groceries/en-GB/shop/pets/all?brand=Good%20Boy&viewAll=brand&page=
307734232,Good Boy Wagtastic Meaty Variety Pack 300G,https://www.tesco.com/groceries/en-GB/shop/pets/all?brand=Good%20Boy&viewAll=brand&page=
306499995,Good Boy Wagtastic Crinkl Legs Dog Toy,https://www.tesco.com/groceries/en-GB/shop/pets/all?brand=Good%20Boy&viewAll=brand&page=
311958952,Good Boy Chompers Unicorn Dog Treats 60G,https://www.tesco.com/groceries/en-GB/shop/pets/all?brand=Good%20Boy&viewAll=brand&page=
305435157,Good Boy Wagtastic Gnaw A Bone Dog Toy,https://www.tesco.com/groceries/en-GB/shop/pets/all?brand=Good%20Boy&viewAll=brand&page=
278128965,Good Boy Sponge Balls Pack 3,https://www.tesco.com/groceries/en-GB/shop/pets/all?brand=Good%20Boy&viewAll=brand&page=
305951012,Good Boy Wagtastic Squeak Vegetable Dog Toys,https://www.tesco.com/groceries/en-GB/shop/pets/all?brand=Good%20Boy&viewAll=brand&page=
299225530,Flexible Fun Large Dog Lead,https://www.tesco.com/groceries/en-GB/shop/pets/all?brand=Good%20Boy&viewAll=brand&page=
309460206,Good Boy Wagtastic Snake Dog Toy,https://www.tesco.com/groceries/en-GB/shop/pets/all?brand=Good%20Boy&viewAll=brand&page=
304383524,Good Boy Dog Toy Flashing Ball,https://www.tesco.com/groceries/en-GB/shop/pets/all?brand=Good%20Boy&viewAll=brand&page=
309759021,Good Boy Wagtastic Wild Tug Dog Toy,https://www.tesco.com/groceries/en-GB/shop/pets/all?brand=Good%20Boy&viewAll=brand&page=
305430992,Pedigree Jumbone Beef & Poultry Maxi 180G,https://www.tesco.com/groceries/en-GB/shop/pets/all?brand=Pedigree&viewAll=brand&page=
305434613,Pedigree Schmackos Fish Mix 20 Pack 144G,https://www.tesco.com/groceries/en-GB/shop/pets/all?brand=Pedigree&viewAll=brand&page=
284829985,Pedigree Pouch Jelly Puppy Pack 12X100g,https://www.tesco.com/groceries/en-GB/shop/pets/all?brand=Pedigree&viewAll=brand&page=
309202732,Pedigree Medium Dog Dentastix Chews 5 Pieces 128G,https://www.tesco.com/groceries/en-GB/shop/pets/all?brand=Pedigree&viewAll=brand&page=
309190174,Pedigree Denta Stix Large Dog 42 Sticks 1.62Kg,https://www.tesco.com/groceries/en-GB/shop/pets/all?brand=Pedigree&viewAll=brand&page=
309180785,Pedigree Large Dog Dentastix Chews 21 Pieces 810G,https://www.tesco.com/groceries/en-GB/shop/pets/all?brand=Pedigree&viewAll=brand&page=
259013148,Pedigree Senior Meaty Loaf Recipes 6 X 400G,https://www.tesco.com/groceries/en-GB/shop/pets/all?brand=Pedigree&viewAll=brand&page=
284829991,Pedigree Pouch Jelly Senior 12X100g,https://www.tesco.com/groceries/en-GB/shop/pets/all?brand=Pedigree&viewAll=brand&page=
312576682,Pedigree Ranchos Tree Dog Treats 52G,https://www.tesco.com/groceries/en-GB/shop/pets/all?brand=Pedigree&viewAll=brand&page=
261593180,Pedigree Daily Denta Stix Dog 56 Stick 1440G,https://www.tesco.com/groceries/en-GB/shop/pets/all?brand=Pedigree&viewAll=brand&page=
309190888,Pedigree Small Dog Dentastix Chews 35 Pieces 550G,https://www.tesco.com/groceries/en-GB/shop/pets/all?brand=Pedigree&viewAll=brand&page=
310166067,Pedigree Christmas Stocking Dog Treats 367G,https://www.tesco.com/groceries/en-GB/shop/pets/all?brand=Pedigree&viewAll=brand&page=
312712510,Pedigree Dog Treats Christmas Gift Box 512G,https://www.tesco.com/groceries/en-GB/shop/pets/all?brand=Pedigree&viewAll=brand&page=
268368839,Pedigree Puppy Cuts In Jelly 6X400g,https://www.tesco.com/groceries/en-GB/shop/pets/all?brand=Pedigree&viewAll=brand&page=
308831962,Pedigree Mixed Selection Dog Food In Gravy 12X100g,https://www.tesco.com/groceries/en-GB/shop/pets/all?brand=Pedigree&viewAll=brand&page=
250316371,Pedigree Meaty Loaf Multipack 6 X 400G,https://www.tesco.com/groceries/en-GB/shop/pets/all?brand=Pedigree&viewAll=brand&page=
311425598,Pedigree Small Dog Adult Dry Food Chicken & Vegetables 3Kg,https://www.tesco.com/groceries/en-GB/shop/pets/all?brand=Pedigree&viewAll=brand&page=
308856495,Pedigree Poultry Mixed Selection Dog Food 12X100g,https://www.tesco.com/groceries/en-GB/shop/pets/all?brand=Pedigree&viewAll=brand&page=
311448686,Pedigree Adult Dry Dog Food Chicken & Vegetable 3Kg,https://www.tesco.com/groceries/en-GB/shop/pets/all?brand=Pedigree&viewAll=brand&page=
309203506,Pedigree Denta Stix Large Dog 4 Sticks 154G,https://www.tesco.com/groceries/en-GB/shop/pets/all?brand=Pedigree&viewAll=brand&page=
309164782,Pedigree Denta Stix Small Dog 70 Sticks 1.1Kg,https://www.tesco.com/groceries/en-GB/shop/pets/all?brand=Pedigree&viewAll=brand&page=
256082498,Whiskas Pouch +1 Meat In Gravy 12X100g,https://www.tesco.com/groceries/en-GB/shop/pets/all?brand=Whiskas&viewAll=brand&page=
264234394,Whiskas Pouches Meat Selection In Jelly 12X100g,https://www.tesco.com/groceries/en-GB/shop/pets/all?brand=Whiskas&viewAll=brand&page=
255740073,Whiskas Crunch 100G,https://www.tesco.com/groceries/en-GB/shop/pets/all?brand=Whiskas&viewAll=brand&page=
255709708,Whiskas Temptations Salmon 60G,https://www.tesco.com/groceries/en-GB/shop/pets/all?brand=Whiskas&viewAll=brand&page=
260569574,Whiskas Kitten With Chicken 2Kg,https://www.tesco.com/groceries/en-GB/shop/pets/all?brand=Whiskas&viewAll=brand&page=
302873466,Whiskas 1+ Dry Cat Food Biscuits Salmon 1.9Kg,https://www.tesco.com/groceries/en-GB/shop/pets/all?brand=Whiskas&viewAll=brand&page=
302872444,Whiskas Cat Food 11+ Meat Selection Pouches 12X100g,https://www.tesco.com/groceries/en-GB/shop/pets/all?brand=Whiskas&viewAll=brand&page=
289131650,Whiskas 7+ Meat Selection In Gravy 12X100g,https://www.tesco.com/groceries/en-GB/shop/pets/all?brand=Whiskas&viewAll=brand&page=
284776142,Whiskas With Tuna 825G,https://www.tesco.com/groceries/en-GB/shop/pets/all?brand=Whiskas&viewAll=brand&page=
267079463,Felix As Good As It Looks Kitten Fish 12X100g,https://www.tesco.com/groceries/en-GB/shop/pets/all?brand=Felix&viewAll=brand&page=
307599989,Felix Crispies Cat Treats Beef & Chicken 180G,https://www.tesco.com/groceries/en-GB/shop/pets/all?brand=Felix&viewAll=brand&page=
255758628,Felix Pouches Poultry Selection In Jelly 12 X 100G,https://www.tesco.com/groceries/en-GB/shop/pets/all?brand=Felix&viewAll=brand&page=
312106485,Felix Naturally Delicious Cat Treat Chicken & Catnip 50G,https://www.tesco.com/groceries/en-GB/shop/pets/all?brand=Felix&viewAll=brand&page=
307303506,Felix Cat Naturally Delicious Farm Selection In Jelly 12X80g,https://www.tesco.com/groceries/en-GB/shop/pets/all?brand=Felix&viewAll=brand&page=
307303564,Felix Cat Naturally Delicious Poultry In Jelly 12X80g,https://www.tesco.com/groceries/en-GB/shop/pets/all?brand=Felix&viewAll=brand&page=
312559668,Felix Naturally Delicious Cat Treat Salmon & Spinach 50G,https://www.tesco.com/groceries/en-GB/shop/pets/all?brand=Felix&viewAll=brand&page=
312833954,Felix Special Purr-Esesnt 5 Treats 300G,https://www.tesco.com/groceries/en-GB/shop/pets/all?brand=Felix&viewAll=brand&page=
291613901,Good Boy Wagtastic Cuddle Friends,https://www.tesco.com/groceries/en-GB/shop/pets/all?brand=Wagtastic&viewAll=brand&page=
291622366,Good Boy Wagtastic Piggy Pal,https://www.tesco.com/groceries/en-GB/shop/pets/all?brand=Wagtastic&viewAll=brand&page=
291622337,Good Boy Wagtastic Squeaky Dumbell,https://www.tesco.com/groceries/en-GB/shop/pets/all?brand=Wagtastic&viewAll=brand&page=
295410242,Wagtastic Dog Toy Threads Crackle,https://www.tesco.com/groceries/en-GB/shop/pets/all?brand=Wagtastic&viewAll=brand&page=
295410305,Wagtastic Dog Toy Super Squeaky,https://www.tesco.com/groceries/en-GB/shop/pets/all?brand=Wagtastic&viewAll=brand&page=
291614249,Good Boy Wagtastic Hug Tugz,https://www.tesco.com/groceries/en-GB/shop/pets/all?brand=Wagtastic&viewAll=brand&page=
291624681,Good Boy Wagtastic Double Dog Brush,https://www.tesco.com/groceries/en-GB/shop/pets/all?brand=Wagtastic&viewAll=brand&page=
291623970,Good Boy Wagtastic Dog Collar & Lead,https://www.tesco.com/groceries/en-GB/shop/pets/all?brand=Wagtastic&viewAll=brand&page=
309464761,Lily's Kitchen Cat Tasty Cuts Chicken In Gravy 85G,https://www.tesco.com/groceries/en-GB/shop/pets/all?brand=Lily%27s%20Kitchen&viewAll=brand&page=
290051052,Lily's Kitchen Venison & Duck Dry Dog Food 1Kg,https://www.tesco.com/groceries/en-GB/shop/pets/all?brand=Lily%27s%20Kitchen&viewAll=brand&page=
309483202,Lily's Kitchen Cat Tasty Cuts Ocean Fish 85G,https://www.tesco.com/groceries/en-GB/shop/pets/all?brand=Lily%27s%20Kitchen&viewAll=brand&page=
309205251,Lily's Kitchen Cat Shredded Fillets Multipack 8X70g,https://www.tesco.com/groceries/en-GB/shop/pets/all?brand=Lily%27s%20Kitchen&viewAll=brand&page=
309451632,Lily's Kitchen Cat Tasty Cuts Mixed Multipack 8X85g,https://www.tesco.com/groceries/en-GB/shop/pets/all?brand=Lily%27s%20Kitchen&viewAll=brand&page=
309479185,Lily's Kitchen Breaktime Biscuits For Dogs 80G,https://www.tesco.com/groceries/en-GB/shop/pets/all?brand=Lily%27s%20Kitchen&viewAll=brand&page=
309475892,Lily's Kitchen Cat Shredded Fillets Chicken & Mussels 70G,https://www.tesco.com/groceries/en-GB/shop/pets/all?brand=Lily%27s%20Kitchen&viewAll=brand&page=
305744619,Gourmet Natures Creation Fish Recipe 8X85g,https://www.tesco.com/groceries/en-GB/shop/pets/all?brand=Gourmet&viewAll=brand&page=
305745359,Purina Gourmet Gold Senior Tinned Pate Salmon 8X85g,https://www.tesco.com/groceries/en-GB/shop/pets/all?brand=Gourmet&viewAll=brand&page=
303227188,Gourmet Gold Savoury Cake Meat 8X85g,https://www.tesco.com/groceries/en-GB/shop/pets/all?brand=Gourmet&viewAll=brand&page=
259503567,Gourmet Gold Chicken & Liver In Gravy 85G,https://www.tesco.com/groceries/en-GB/shop/pets/all?brand=Gourmet&viewAll=brand&page=
265372239,Gourmet Gold Salmon & Chicken In Gravy 85G,https://www.tesco.com/groceries/en-GB/shop/pets/all?brand=Gourmet&viewAll=brand&page=
294814359,Tesco Dog Pouch Chunks In Gravy 12 X100g,https://www.tesco.com/groceries/en-GB/shop/pets/all?brand=Tesco%20Pet&viewAll=brand&page=
308089567,Tesco Tasty Treats Pocket Pillows With Cheese 65G,https://www.tesco.com/groceries/en-GB/shop/pets/all?brand=Tesco%20Pet&viewAll=brand&page=
308097557,Tesco Tasty Treats Pocket Pillows With Chicken 65G,https://www.tesco.com/groceries/en-GB/shop/pets/all?brand=Tesco%20Pet&viewAll=brand&page=
305041778,Tesco Training Treats Chicken 160G,https://www.tesco.com/groceries/en-GB/shop/pets/all?brand=Tesco%20Pet&viewAll=brand&page=
308464209,Tesco Adult Cat Pate With White Fish 100G,https://www.tesco.com/groceries/en-GB/shop/pets/all?brand=Tesco%20Pet&viewAll=brand&page=
308117149,Tesco Wild Bird Coconut Feeder,https://www.tesco.com/groceries/en-GB/shop/pets/all?brand=Tesco%20Pet&viewAll=brand&page=
307742809,Tesco Senior Chicken & Vegetable Dry Cat Food 2Kg,https://www.tesco.com/groceries/en-GB/shop/pets/all?brand=Tesco%20Pet&viewAll=brand&page=
308079251,Tesco Adult Dog 12 Pate Selection Chicken Turkey Liver 1.8Kg,https://www.tesco.com/groceries/en-GB/shop/pets/all?brand=Tesco%20Pet&viewAll=brand&page=
308463251,Tesco Puppy Select 6X400g Cans,https://www.tesco.com/groceries/en-GB/shop/pets/all?brand=Tesco%20Pet&viewAll=brand&page=
308460922,Tesco Puppy With Chicken & Vegetables 3Kg,https://www.tesco.com/groceries/en-GB/shop/pets/all?brand=Tesco%20Pet&viewAll=brand&page=
284998835,Tesco Wild Bird Food Meal Worm 100G,https://www.tesco.com/groceries/en-GB/shop/pets/all?brand=Tesco%20Pet&viewAll=brand&page=
308470392,Tesco Adult Dog Chunks In Jelly Chicken 1.2Kg,https://www.tesco.com/groceries/en-GB/shop/pets/all?brand=Tesco%20Pet&viewAll=brand&page=
312221123,Nature's Choice Chicken With Vegetable Dog Food 390G,https://www.tesco.com/groceries/en-GB/shop/pets/all?brand=Tesco%20Pet&viewAll=brand&page=
312217935,Nature's Choice Turkey Liver & Vegetable Dog Food 390G,https://www.tesco.com/groceries/en-GB/shop/pets/all?brand=Tesco%20Pet&viewAll=brand&page=
312230164,"Nature's Choice Beef, Chicken & Vegetable Dog Food 390G",https://www.tesco.com/groceries/en-GB/shop/pets/all?brand=Tesco%20Pet&viewAll=brand&page=
308108736,Tesco Wild Bird Everyday Seed Mix 12.5Kg,https://www.tesco.com/groceries/en-GB/shop/pets/all?brand=Tesco%20Pet&viewAll=brand&page=
278701684,Tesco Dry Food Mixer Adult Dog 4Kg,https://www.tesco.com/groceries/en-GB/shop/pets/all?brand=Tesco%20Pet&viewAll=brand&page=
307754035,Tesco Wild Bird Sunflower Hearts 1Kg,https://www.tesco.com/groceries/en-GB/shop/pets/all?brand=Tesco%20Pet&viewAll=brand&page=
278702014,Tesco Senior With Chicken 3Kg,https://www.tesco.com/groceries/en-GB/shop/pets/all?brand=Tesco%20Pet&viewAll=brand&page=
284998340,Tesco Standard Wild Bird Food Suet Tray 300G,https://www.tesco.com/groceries/en-GB/shop/pets/all?brand=Tesco%20Pet&viewAll=brand&page=
308103217,Nature's Choice Lamb Dry Dog Food 2Kg,https://www.tesco.com/groceries/en-GB/shop/pets/all?brand=Tesco%20Pet&viewAll=brand&page=
308114567,Nature's Choice Turkey Dry Dog Food 2Kg,https://www.tesco.com/groceries/en-GB/shop/pets/all?brand=Tesco%20Pet&viewAll=brand&page=
308117570,Tesco Senior Dog Mixed Selection In Jelly 12X100g,https://www.tesco.com/groceries/en-GB/shop/pets/all?brand=Tesco%20Pet&viewAll=brand&page=
291125004,Tesco Beef Chunks In Gravy 300G,https://www.tesco.com/groceries/en-GB/shop/pets/all?brand=Tesco%20Pet&viewAll=brand&page=
309472549,Good Boy Wagtastic Flyer Dog Toy,https://www.tesco.com/groceries/en-GB/shop/pets/all?brand=Good%20Boy&viewAll=brand&page=
298872790,Wagtastic Toy Raggy Crinkle Dog Toy,https://www.tesco.com/groceries/en-GB/shop/pets/all?brand=Good%20Boy&viewAll=brand&page=
302217893,Good Boy Assorted Soft Woolies Dog Toy,https://www.tesco.com/groceries/en-GB/shop/pets/all?brand=Good%20Boy&viewAll=brand&page=
298872818,Wagtastic Toy Rope Dumbell Dog Toy,https://www.tesco.com/groceries/en-GB/shop/pets/all?brand=Good%20Boy&viewAll=brand&page=
309483179,Good Boy Wagtastic Cage Ball Dog Toy,https://www.tesco.com/groceries/en-GB/shop/pets/all?brand=Good%20Boy&viewAll=brand&page=
299225461,Flexible Fun Dog Lead Medium,https://www.tesco.com/groceries/en-GB/shop/pets/all?brand=Good%20Boy&viewAll=brand&page=
309786132,Good Boy Wagtastic Dino Dog Toy,https://www.tesco.com/groceries/en-GB/shop/pets/all?brand=Good%20Boy&viewAll=brand&page=
