Product ID,Product Name,Brand Link
305745412,Purina Gourmet Gold Tinned Double Delicacies 8X85g,https://www.tesco.com/groceries/en-GB/shop/pets/all?brand=Gourmet&viewAll=brand&page=
305745308,Purina Gourmet Tinned Food Pate Mixed 8X85g,https://www.tesco.com/groceries/en-GB/shop/pets/all?brand=Gourmet&viewAll=brand&page=
268175556,Gourmet Gold Duo Duck And Turkey 85G,https://www.tesco.com/groceries/en-GB/shop/pets/all?brand=Gourmet&viewAll=brand&page=
305744730,Purina Gourmet Natures Creation Meat Recipe 8X85g,https://www.tesco.com/groceries/en-GB/shop/pets/all?brand=Gourmet&viewAll=brand&page=
257971591,Gourmet Perle Cat Food Chefs Collection 12 X 85G,https://www.tesco.com/groceries/en-GB/shop/pets/all?brand=Gourmet&viewAll=brand&page=
308869382,Gourmet Revelations Salmon Cat Food 4 X 57G,https://www.tesco.com/groceries/en-GB/shop/pets/all?brand=Gourmet&viewAll=brand&page=
272391004,Gourmet Perle Seaside Duo 12X85g,https://www.tesco.com/groceries/en-GB/shop/pets/all?brand=Gourmet&viewAll=brand&page=
310180409,Gourmet Revelations Tuna Cat Food 4 X 57G,https://www.tesco.com/groceries/en-GB/shop/pets/all?brand=Gourmet&viewAll=brand&page=
298437217,Gourmet Gold Melting Heart Salmon Cat 85G,https://www.tesco.com/groceries/en-GB/shop/pets/all?brand=Gourmet&viewAll=brand&page=
312838577,Harringtons Adult Salmon & Potato 1.7Kg,https://www.tesco.com/groceries/en-GB/shop/pets/all?brand=Harringtons&viewAll=brand&page=
312716039,Harringtons Adult Lamb & Rice 1.7Kg,https://www.tesco.com/groceries/en-GB/shop/pets/all?brand=Harringtons&viewAll=brand&page=
310116355,Harringtons Turkey & Vegetables Tinned Dog Food 400G,https://www.tesco.com/groceries/en-GB/shop/pets/all?brand=Harringtons&viewAll=brand&page=
310098542,Harringtons Chicken & Vegetables Tinned Dog Food 400G,https://www.tesco.com/groceries/en-GB/shop/pets/all?brand=Harringtons&viewAll=brand&page=
299226333,Harringtons Grain Free Chicken & Vegetable Adult Dog 400G,https://www.tesco.com/groceries/en-GB/shop/pets/all?brand=Harringtons&viewAll=brand&page=
312843487,Harringtons Grain Free Adult Dog Food Chicken & Sw/Pot 1Kg,https://www.tesco.com/groceries/en-GB/shop/pets/all?brand=Harringtons&viewAll=brand&page=
312828546,Harringtons Small Adult Turkey & Rice 1Kg,https://www.tesco.com/groceries/en-GB/shop/pets/all?brand=Harringtons&viewAll=brand&page=
299226477,Harringtons Dog Food Turkey Vegetable & Potato 400G,https://www.tesco.com/groceries/en-GB/shop/pets/all?brand=Harringtons&viewAll=brand&page=
312848476,Harringtons Adult Dog Food Lamb & Rice 4Kg,https://www.tesco.com/groceries/en-GB/shop/pets/all?brand=Harringtons&viewAll=brand&page=
312715242,Harringtons Adult Dog Food Turkey & Vegetable 4Kg,https://www.tesco.com/groceries/en-GB/shop/pets/all?brand=Harringtons&viewAll=brand&page=
312832926,Harringtons Adult Beef & Rice 4Kg,https://www.tesco.com/groceries/en-GB/shop/pets/all?brand=Harringtons&viewAll=brand&page=
312855778,Harringtons Adult Chicken & Rice 4Kg,https://www.tesco.com/groceries/en-GB/shop/pets/all?brand=Harringtons&viewAll=brand&page=
307345934,Harringtons Turkey & Vegetable Complete Dog Food 12Kg,https://www.tesco.com/groceries/en-GB/shop/pets/all?brand=Harringtons&viewAll=brand&page=
310160969,Harringtons Meaty Selection In Jelly 12X85g,https://www.tesco.com/groceries/en-GB/shop/pets/all?brand=Harringtons&viewAll=brand&page=
304410551,Harringtons Adult Dog Mixed Selection Box 6X400g,https://www.tesco.com/groceries/en-GB/shop/pets/all?brand=Harringtons&viewAll=brand&page=
310101050,Harringtons Fish Selection In Jelly 12X85g,https://www.tesco.com/groceries/en-GB/shop/pets/all?brand=Harringtons&viewAll=brand&page=
307753290,Harringtons Lamb & Rice Complete Dog Food 12Kg,https://www.tesco.com/groceries/en-GB/shop/pets/all?brand=Harringtons&viewAll=brand&page=
305249406,Harringtons Poultry Selection Box Dog Food 6X400g,https://www.tesco.com/groceries/en-GB/shop/pets/all?brand=Harringtons&viewAll=brand&page=
310660130,Harringtons Advanced Science Diet Dry Dog Large Breed2kg,https://www.tesco.com/groceries/en-GB/shop/pets/all?brand=Harringtons&viewAll=brand&page=
310108820,Harringtons Meaty Selection In Gravy 12X85g,https://www.tesco.com/groceries/en-GB/shop/pets/all?brand=Harringtons&viewAll=brand&page=
312565021,Harringtons Senior Chicken & Rice 1.7Kg,https://www.tesco.com/groceries/en-GB/shop/pets/all?brand=Harringtons&viewAll=brand&page=
312853106,Harringtons Adult Dog Food Salmon & Sw/Pot 1Kg,https://www.tesco.com/groceries/en-GB/shop/pets/all?brand=Harringtons&viewAll=brand&page=
312721931,Harringtons Puppy Turkey & Rice 1.7Kg,https://www.tesco.com/groceries/en-GB/shop/pets/all?brand=Harringtons&viewAll=brand&page=
308822230,Sheba Fresh & Fine Chicken & Turkey In Gravy 6X50g,https://www.tesco.com/groceries/en-GB/shop/pets/all?brand=Sheba&viewAll=brand&page=
263361716,Sheba Pouch Fine Flake Poultry 12X85g,https://www.tesco.com/groceries/en-GB/shop/pets/all?brand=Sheba&viewAll=brand&page=
263361843,Sheba Pouch Fine Flake Fish Selection 12X85g,https://www.tesco.com/groceries/en-GB/shop/pets/all?brand=Sheba&viewAll=brand&page=
308838528,Sheba Fresh & Fine Tuna & Cod In Gravy 6X50g,https://www.tesco.com/groceries/en-GB/shop/pets/all?brand=Sheba&viewAll=brand&page=
308864905,Sheba Fresh & Fine Turkey & Chicken In Jelly 6X50g,https://www.tesco.com/groceries/en-GB/shop/pets/all?brand=Sheba&viewAll=brand&page=
310188142,Sheba Cat Food Chicken Fillet Soup Pouches 4X40g,https://www.tesco.com/groceries/en-GB/shop/pets/all?brand=Sheba&viewAll=brand&page=
293638857,Sheba Cat Pouch Fish In Gravy 12X85g,https://www.tesco.com/groceries/en-GB/shop/pets/all?brand=Sheba&viewAll=brand&page=
309171099,Sheba Fresh & Fine Salmon & Tuna In Gravy 6X50g,https://www.tesco.com/groceries/en-GB/shop/pets/all?brand=Sheba&viewAll=brand&page=
310683347,Sheba Cat Food Tuna Fillet Soup Pouches 4X40g,https://www.tesco.com/groceries/en-GB/shop/pets/all?brand=Sheba&viewAll=brand&page=
308473325,Sheba Fresh & Fine Beef & Chicken In Gravy 6X50g,https://www.tesco.com/groceries/en-GB/shop/pets/all?brand=Sheba&viewAll=brand&page=
293638834,Sheba Cat Pouch Poultry In Gravy 12X85g,https://www.tesco.com/groceries/en-GB/shop/pets/all?brand=Sheba&viewAll=brand&page=
293773022,Sheba Pouch Succulent In Gravy 12*85G,https://www.tesco.com/groceries/en-GB/shop/pets/all?brand=Sheba&viewAll=brand&page=
304789937,Sheba Select Slices Poultry Selection In Gravy 40X85g,https://www.tesco.com/groceries/en-GB/shop/pets/all?brand=Sheba&viewAll=brand&page=
297646858,Sheba Pouch Poultry Chicken In Jelly 40 Pack X 85G,https://www.tesco.com/groceries/en-GB/shop/pets/all?brand=Sheba&viewAll=brand&page=
295446021,Sheba Succulent Jelly Selection Cat Pouches 12X85g,https://www.tesco.com/groceries/en-GB/shop/pets/all?brand=Sheba&viewAll=brand&page=
305042149,Sheba Fine Flakes In Gravy Fish Selection 12 X 85G,https://www.tesco.com/groceries/en-GB/shop/pets/all?brand=Sheba&viewAll=brand&page=
304788253,Sheba Fine Flakes Poultry Selection In Gravy 12X85g,https://www.tesco.com/groceries/en-GB/shop/pets/all?brand=Sheba&viewAll=brand&page=
308860309,Sheba Fresh Cuisine Tokyo 'Seln Salmon & Tuna 6X50g,https://www.tesco.com/groceries/en-GB/shop/pets/all?brand=Sheba&viewAll=brand&page=
311201569,Sheba Sauce Lover In Gravy Mixed Collection 8X85g,https://www.tesco.com/groceries/en-GB/shop/pets/all?brand=Sheba&viewAll=brand&page=
311250389,Sheba Select Slices In Gravy Poultry Selection 8X85g,https://www.tesco.com/groceries/en-GB/shop/pets/all?brand=Sheba&viewAll=brand&page=
311271934,Sheba Classics In Terrine Ocean Selection 8X85g,https://www.tesco.com/groceries/en-GB/shop/pets/all?brand=Sheba&viewAll=brand&page=
286765209,Sheba Tray Slices Gravy With Chicken 85G,https://www.tesco.com/groceries/en-GB/shop/pets/all?brand=Sheba&viewAll=brand&page=
286764922,Sheba Tray Sauce Lamb & Vegetable 85G,https://www.tesco.com/groceries/en-GB/shop/pets/all?brand=Sheba&viewAll=brand&page=
311251549,Core Supply Medium Melamine Stainless Steel Pet Bowl Assorted,https://www.tesco.com/groceries/en-GB/shop/pets/all?brand=Core%20Supply%20Co&viewAll=brand&page=
311793380,Core Supply Bone Bag Clips 2 Pack,https://www.tesco.com/groceries/en-GB/shop/pets/all?brand=Core%20Supply%20Co&viewAll=brand&page=
312220775,Core Supply Large Melamine Stainless Steel Pet Bowl Assorted,https://www.tesco.com/groceries/en-GB/shop/pets/all?brand=Core%20Supply%20Co&viewAll=brand&page=
310666705,Core Supply Pet Grooming Textured Towel,https://www.tesco.com/groceries/en-GB/shop/pets/all?brand=Core%20Supply%20Co&viewAll=brand&page=
311432353,Core Supply Ceramic Dog Bowl,https://www.tesco.com/groceries/en-GB/shop/pets/all?brand=Core%20Supply%20Co&viewAll=brand&page=
311250251,Core Supply Dog Bandana With Collar,https://www.tesco.com/groceries/en-GB/shop/pets/all?brand=Core%20Supply%20Co&viewAll=brand&page=
311425638,Core Supply 350Ml Dog Drink Bottle Assortment,https://www.tesco.com/groceries/en-GB/shop/pets/all?brand=Core%20Supply%20Co&viewAll=brand&page=
312109706,Core Supply Debossed Ceramic Pet Bowl Large,https://www.tesco.com/groceries/en-GB/shop/pets/all?brand=Core%20Supply%20Co&viewAll=brand&page=
311947274,Core Supply Small Ceramic Slogan Pet Bowl Assorted,https://www.tesco.com/groceries/en-GB/shop/pets/all?brand=Core%20Supply%20Co&viewAll=brand&page=
311225837,Core Supply Fetch & Treat Pouch,https://www.tesco.com/groceries/en-GB/shop/pets/all?brand=Core%20Supply%20Co&viewAll=brand&page=
311422244,Core Supply Ceramic Cat Bowl,https://www.tesco.com/groceries/en-GB/shop/pets/all?brand=Core%20Supply%20Co&viewAll=brand&page=
310151116,Core Supply Pet Food Can Covers,https://www.tesco.com/groceries/en-GB/shop/pets/all?brand=Core%20Supply%20Co&viewAll=brand&page=
310682098,Core Supply Pet Grooming Glove Mitt,https://www.tesco.com/groceries/en-GB/shop/pets/all?brand=Core%20Supply%20Co&viewAll=brand&page=
312232133,Core Supply Ceramic Pet Bowl Large Assortment,https://www.tesco.com/groceries/en-GB/shop/pets/all?brand=Core%20Supply%20Co&viewAll=brand&page=
312219259,Core Supply Debossed Ceramic Pet Bow Small,https://www.tesco.com/groceries/en-GB/shop/pets/all?brand=Core%20Supply%20Co&viewAll=brand&page=
311800442,Core Supply Collapsible Pet Bowl 1L Assorted,https://www.tesco.com/groceries/en-GB/shop/pets/all?brand=Core%20Supply%20Co&viewAll=brand&page=
311434307,Core Supply Mug With Cat Toy,https://www.tesco.com/groceries/en-GB/shop/pets/all?brand=Core%20Supply%20Co&viewAll=brand&page=
311441549,Core Supply Mug With Dog Toy,https://www.tesco.com/groceries/en-GB/shop/pets/all?brand=Core%20Supply%20Co&viewAll=brand&page=
312351815,Core Supply Small Melamine Stainless Steel Pet Bowl Assorted,https://www.tesco.com/groceries/en-GB/shop/pets/all?brand=Core%20Supply%20Co&viewAll=brand&page=
310661964,Core Supply Pet Food Storage Assorted,https://www.tesco.com/groceries/en-GB/shop/pets/all?brand=Core%20Supply%20Co&viewAll=brand&page=
311668347,Core Supply Collapsible Pet Bowel 354Ml Assorted,https://www.tesco.com/groceries/en-GB/shop/pets/all?brand=Core%20Supply%20Co&viewAll=brand&page=
311445666,Core Supply Dog Bandana With Collar,https://www.tesco.com/groceries/en-GB/shop/pets/all?brand=Core%20Supply%20Co&viewAll=brand&page=
284355934,Bakers Allsorts Pack 98G,https://www.tesco.com/groceries/en-GB/shop/pets/all?brand=Bakers&viewAll=brand&page=
303837445,Bakers Whirlers Dog Treats Bacon And Cheese 130G,https://www.tesco.com/groceries/en-GB/shop/pets/all?brand=Bakers&viewAll=brand&page=
303837409,Bakers Sizzlers Dog Treats Bacon 90G,https://www.tesco.com/groceries/en-GB/shop/pets/all?brand=Bakers&viewAll=brand&page=
284355462,Bakers Mixed Variety Pack 100G,https://www.tesco.com/groceries/en-GB/shop/pets/all?brand=Bakers&viewAll=brand&page=
301074837,Bakers Small Dog Food Chicken & Vegetables 1.1Kg,https://www.tesco.com/groceries/en-GB/shop/pets/all?brand=Bakers&viewAll=brand&page=
270954391,Bakers Complete Meaty Meals Small Dog Beef 1Kg,https://www.tesco.com/groceries/en-GB/shop/pets/all?brand=Bakers&viewAll=brand&page=
268353275,Bakers Joint Delicious Large Chicken 240G,https://www.tesco.com/groceries/en-GB/shop/pets/all?brand=Bakers&viewAll=brand&page=
267084986,Bakers Dental Delicious Medium Chicken 200G,https://www.tesco.com/groceries/en-GB/shop/pets/all?brand=Bakers&viewAll=brand&page=
302480182,Bakers Sizzlers Dog Treats Bacon 185G,https://www.tesco.com/groceries/en-GB/shop/pets/all?brand=Bakers&viewAll=brand&page=
255335582,Bakers 2 Meaty Twists 180G,https://www.tesco.com/groceries/en-GB/shop/pets/all?brand=Bakers&viewAll=brand&page=
307510998,Bakers Whirlers Meaty Dog Treats Bacon & Cheese 270G,https://www.tesco.com/groceries/en-GB/shop/pets/all?brand=Bakers&viewAll=brand&page=
278432126,Bakers Complete Meaty Meals Chicken 2.7Kg,https://www.tesco.com/groceries/en-GB/shop/pets/all?brand=Bakers&viewAll=brand&page=
301086875,Bakers Dog Food Chicken And Vegetables 1.2Kg,https://www.tesco.com/groceries/en-GB/shop/pets/all?brand=Bakers&viewAll=brand&page=
301086938,Bakers Small Dog Food Beef & Vegetable 2.85Kg,https://www.tesco.com/groceries/en-GB/shop/pets/all?brand=Bakers&viewAll=brand&page=
312827392,Bakers Christmas Gift Box Dog Treats 386G,https://www.tesco.com/groceries/en-GB/shop/pets/all?brand=Bakers&viewAll=brand&page=
301086839,Bakers Puppy Dog Food Chicken & Vegetable 1.1Kg,https://www.tesco.com/groceries/en-GB/shop/pets/all?brand=Bakers&viewAll=brand&page=
301086898,Bakers Senior Dog Food Chicken & Vegetable 2.85Kg,https://www.tesco.com/groceries/en-GB/shop/pets/all?brand=Bakers&viewAll=brand&page=
301074814,Bakers Small Dog Food Beef & Vegetables 1.1Kg,https://www.tesco.com/groceries/en-GB/shop/pets/all?brand=Bakers&viewAll=brand&page=
298911284,Bakers Adult Beef & Vegetable 12Kg,https://www.tesco.com/groceries/en-GB/shop/pets/all?brand=Bakers&viewAll=brand&page=
299195450,Bakers Adult Chicken & Vegetable 12Kg,https://www.tesco.com/groceries/en-GB/shop/pets/all?brand=Bakers&viewAll=brand&page=
302054883,Butcher's Tripe Loaf Dog Food Tins 12X400g,https://www.tesco.com/groceries/en-GB/shop/pets/all?brand=Butchers&viewAll=brand&page=
311258300,Butchers Joint & Coat Dog Food Mixed Selection 12X150g,https://www.tesco.com/groceries/en-GB/shop/pets/all?brand=Butchers&viewAll=brand&page=
302054900,Butcher's Meaty Recipe In Jelly Dog Food 12X400g,https://www.tesco.com/groceries/en-GB/shop/pets/all?brand=Butchers&viewAll=brand&page=
302055663,Butcher's Recipe In Gravy Dog Food Tin 12X400g,https://www.tesco.com/groceries/en-GB/shop/pets/all?brand=Butchers&viewAll=brand&page=
302054134,Butcher's Simply Gentle Dog Food Tins 6X390g,https://www.tesco.com/groceries/en-GB/shop/pets/all?brand=Butchers&viewAll=brand&page=
302411189,Butcher's Tripe Dog Food Tin 400G,https://www.tesco.com/groceries/en-GB/shop/pets/all?brand=Butchers&viewAll=brand&page=
299269777,Butchers Traditional Recipe 12X150g Foiltray,https://www.tesco.com/groceries/en-GB/shop/pets/all?brand=Butchers&viewAll=brand&page=
299271210,Butcher's Simply Gentle Dog Food Trays 12X150g,https://www.tesco.com/groceries/en-GB/shop/pets/all?brand=Butchers&viewAll=brand&page=
299269731,Butchers Succulent 12X150g Foiltray,https://www.tesco.com/groceries/en-GB/shop/pets/all?brand=Butchers&viewAll=brand&page=
302038972,Butchers Tripe Grain Free Dog Food 2400G,https://www.tesco.com/groceries/en-GB/shop/pets/all?brand=Butchers&viewAll=brand&page=
308094140,Butcher's Grain Free Joints & Coat 6X390g,https://www.tesco.com/groceries/en-GB/shop/pets/all?brand=Butchers&viewAll=brand&page=
299271157,Butcher's Traditional Recipes Dog Food Tray 4 X 150G,https://www.tesco.com/groceries/en-GB/shop/pets/all?brand=Butchers&viewAll=brand&page=
301184724,Butchers Lean & Tasty 12X150g Foiltray,https://www.tesco.com/groceries/en-GB/shop/pets/all?brand=Butchers&viewAll=brand&page=
302039055,Butcher's Tripe Loaf Dog Food Tins 6X400g,https://www.tesco.com/groceries/en-GB/shop/pets/all?brand=Butchers&viewAll=brand&page=
302039078,Butcher's Loaf Recipes Dog Food Tins 6X390g,https://www.tesco.com/groceries/en-GB/shop/pets/all?brand=Butchers&viewAll=brand&page=
302054860,Butcher's Puppy Perfect Puppy Food Tins 6X400g,https://www.tesco.com/groceries/en-GB/shop/pets/all?brand=Butchers&viewAll=brand&page=
312368145,Butcher's Lean & Tasty Low Fat Dog Food 12X390g,https://www.tesco.com/groceries/en-GB/shop/pets/all?brand=Butchers&viewAll=brand&page=
299271170,Butcher's Succulent Recipe Trays 4 X 150G,https://www.tesco.com/groceries/en-GB/shop/pets/all?brand=Butchers&viewAll=brand&page=
257972929,Purina One Adult Dry Cat Food Chicken & Wholegrain 800G,https://www.tesco.com/groceries/en-GB/shop/pets/all?brand=Purina%20One&viewAll=brand&page=
257972699,Purina One Cat Adult Salmon & Whole Grain 800G,https://www.tesco.com/groceries/en-GB/shop/pets/all?brand=Purina%20One&viewAll=brand&page=
268368511,Purina One Cat Sensitive With Turkey & Rice 800G,https://www.tesco.com/groceries/en-GB/shop/pets/all?brand=Purina%20One&viewAll=brand&page=
266352982,Purina One Kitten Junior Chicken & Whole Grains 800G,https://www.tesco.com/groceries/en-GB/shop/pets/all?brand=Purina%20One&viewAll=brand&page=
303227142,Purina One Senior 11+ Dry Cat Food Chicken 800G,https://www.tesco.com/groceries/en-GB/shop/pets/all?brand=Purina%20One&viewAll=brand&page=
282171935,Purina One Wet Chicken Beef 8X85g,https://www.tesco.com/groceries/en-GB/shop/pets/all?brand=Purina%20One&viewAll=brand&page=
307284677,Purina One Selective Palate Cat Meals 8X85g,https://www.tesco.com/groceries/en-GB/shop/pets/all?brand=Purina%20One&viewAll=brand&page=
257974173,Purina One Cat Adult Salmon & Whole Grain 3Kg,https://www.tesco.com/groceries/en-GB/shop/pets/all?brand=Purina%20One&viewAll=brand&page=
257973082,Purina One Cat Adult Chicken & Whole Grains 3Kg,https://www.tesco.com/groceries/en-GB/shop/pets/all?brand=Purina%20One&viewAll=brand&page=
282154182,Purina One Wet Meat Chicken Beef 8X85g,https://www.tesco.com/groceries/en-GB/shop/pets/all?brand=Purina%20One&viewAll=brand&page=
271668745,Purina One Cat Senior Chicken & Whole Grains 800G,https://www.tesco.com/groceries/en-GB/shop/pets/all?brand=Purina%20One&viewAll=brand&page=
266166046,Purina One Cat Indoor Formula Turkey W/Grain800g,https://www.tesco.com/groceries/en-GB/shop/pets/all?brand=Purina%20One&viewAll=brand&page=
268368350,Purina One Cat Light 800G,https://www.tesco.com/groceries/en-GB/shop/pets/all?brand=Purina%20One&viewAll=brand&page=
291612401,Purina One Sensitive Turkey & Rice 3Kg,https://www.tesco.com/groceries/en-GB/shop/pets/all?brand=Purina%20One&viewAll=brand&page=
295195927,Purina One Coat & Hairball Chicken 3Kg,https://www.tesco.com/groceries/en-GB/shop/pets/all?brand=Purina%20One&viewAll=brand&page=
303205519,Purina One Senior 11+ Dry Cat Food Chicken 3Kg,https://www.tesco.com/groceries/en-GB/shop/pets/all?brand=Purina%20One&viewAll=brand&page=
286785151,Purina One Senior Chicken & Wholegrain 3Kg,https://www.tesco.com/groceries/en-GB/shop/pets/all?brand=Purina%20One&viewAll=brand&page=
301767939,Iams Adult 1+ Cat Food With Fresh Chicken 800G,https://www.tesco.com/groceries/en-GB/shop/pets/all?brand=Iams&viewAll=brand&page=
301743530,Iams Cat Food Senior 7+ With Fresh Chicken 2Kg,https://www.tesco.com/groceries/en-GB/shop/pets/all?brand=Iams&viewAll=brand&page=
301744016,Iams Small Medium Adult Dog Food With Chicken 2Kg,https://www.tesco.com/groceries/en-GB/shop/pets/all?brand=Iams&viewAll=brand&page=
301743490,Iams Cat Food Senior With Chicken 800G,https://www.tesco.com/groceries/en-GB/shop/pets/all?brand=Iams&viewAll=brand&page=
301744477,Iams Dog Food Small & Medium Adult With Chicken 800G,https://www.tesco.com/groceries/en-GB/shop/pets/all?brand=Iams&viewAll=brand&page=
301767951,Iams Adult 1+ Cat Food With Fresh Chicken 2Kg,https://www.tesco.com/groceries/en-GB/shop/pets/all?brand=Iams&viewAll=brand&page=
301743927,Iams Small Medium Senior Dog Food With Chicken 2Kg,https://www.tesco.com/groceries/en-GB/shop/pets/all?brand=Iams&viewAll=brand&page=
295196022,Iams Delights Land & Sea Jelly Pouches 12X85g,https://www.tesco.com/groceries/en-GB/shop/pets/all?brand=Iams&viewAll=brand&page=
301744454,"Iams Dog Food Puppy Small, Medium With Chicken 800G",https://www.tesco.com/groceries/en-GB/shop/pets/all?brand=Iams&viewAll=brand&page=
301767997,Iams For Vitality Adult 1+ Catfood Ocean Fish 2Kg,https://www.tesco.com/groceries/en-GB/shop/pets/all?brand=Iams&viewAll=brand&page=
301743645,Iams Dog Food Adult Light In Fat With Chicken 2Kg,https://www.tesco.com/groceries/en-GB/shop/pets/all?brand=Iams&viewAll=brand&page=
301743599,Iams Senior 7+ Cat Food With Ocean Fish 2Kg,https://www.tesco.com/groceries/en-GB/shop/pets/all?brand=Iams&viewAll=brand&page=
301744517,Iams Cat Food Adult Light In Fat With Chicken 2Kg,https://www.tesco.com/groceries/en-GB/shop/pets/all?brand=Iams&viewAll=brand&page=
295196045,Iams Delights Land & Sea Gravy Pouches 12X85g,https://www.tesco.com/groceries/en-GB/shop/pets/all?brand=Iams&viewAll=brand&page=
295196068,Iams Delights Senior Cat Food Chicken In Gravy 12X85g,https://www.tesco.com/groceries/en-GB/shop/pets/all?brand=Iams&viewAll=brand&page=
309191023,Nood Sustainable Fish Recipes In Jelly 8X85g,https://www.tesco.com/groceries/en-GB/shop/pets/all?brand=Nood&viewAll=brand&page=
309194613,Nood Cage Free Poultry Recipes In Jelly 7+ 8X85g,https://www.tesco.com/groceries/en-GB/shop/pets/all?brand=Nood&viewAll=brand&page=
309167462,Nood Cage-Free Poultry Recipes In Gravy 8X85g,https://www.tesco.com/groceries/en-GB/shop/pets/all?brand=Nood&viewAll=brand&page=
309755031,Nood Dry Cat Food Salmon With Vegetables 750G,https://www.tesco.com/groceries/en-GB/shop/pets/all?brand=Nood&viewAll=brand&page=
309184251,Nood Cage-Free Poultry Recipes In Jelly 8X85g,https://www.tesco.com/groceries/en-GB/shop/pets/all?brand=Nood&viewAll=brand&page=
309776812,Nood Dry Cat Food Chicken With Vegetables 750G,https://www.tesco.com/groceries/en-GB/shop/pets/all?brand=Nood&viewAll=brand&page=
309449653,Nood Dry Cat Food Chicken With Vegetables 7+Yrs 750G,https://www.tesco.com/groceries/en-GB/shop/pets/all?brand=Nood&viewAll=brand&page=
309453198,Nood Dry Cat Food Chicken With Vegetables 2.5Kg,https://www.tesco.com/groceries/en-GB/shop/pets/all?brand=Nood&viewAll=brand&page=
309783819,Nood Dry Dog Food Chicken & Vegetable 1.4Kg,https://www.tesco.com/groceries/en-GB/shop/pets/all?brand=Nood&viewAll=brand&page=
309167934,Nood Sustainable Fish Recipes In Gravy 8X85g,https://www.tesco.com/groceries/en-GB/shop/pets/all?brand=Nood&viewAll=brand&page=
309789624,Nood Dry Dog Food Beef With Vegetables 1.4Kg,https://www.tesco.com/groceries/en-GB/shop/pets/all?brand=Nood&viewAll=brand&page=
309473548,Nood Dry Dog Food Salmon With Vegetables 1.4Kg,https://www.tesco.com/groceries/en-GB/shop/pets/all?brand=Nood&viewAll=brand&page=
309765877,Nood Dry Dog Food Beef With Vegetables 2.9Kg,https://www.tesco.com/groceries/en-GB/shop/pets/all?brand=Nood&viewAll=brand&page=
309776340,Nood Dry Cat Food Chicken & Vegetables 7+Years 2.5Kg,https://www.tesco.com/groceries/en-GB/shop/pets/all?brand=Nood&viewAll=brand&page=
309774993,Nood Dry Cat Food Salmon With Vegetables 2.5Kg,https://www.tesco.com/groceries/en-GB/shop/pets/all?brand=Nood&viewAll=brand&page=
308091539,Cesar Classic Terrine 8X150g,https://www.tesco.com/groceries/en-GB/shop/pets/all?brand=Cesar&viewAll=brand&page=
308092096,Cesar Classic Terrine Chicken & Turkey Dog Food 150G,https://www.tesco.com/groceries/en-GB/shop/pets/all?brand=Cesar&viewAll=brand&page=
308095346,Cesar Country Stew Dog Food Assorted 8 X 150G,https://www.tesco.com/groceries/en-GB/shop/pets/all?brand=Cesar&viewAll=brand&page=
305052166,Cesar Senior Chicken & Turkey Dog Pouches 12 Pack,https://www.tesco.com/groceries/en-GB/shop/pets/all?brand=Cesar&viewAll=brand&page=
308116058,Cesar Juicy Hotpot 8X150g,https://www.tesco.com/groceries/en-GB/shop/pets/all?brand=Cesar&viewAll=brand&page=
308086772,Cesar Senior 10+ In Delicate Jelly 8X150g,https://www.tesco.com/groceries/en-GB/shop/pets/all?brand=Cesar&viewAll=brand&page=
304783667,Cesar Senior 10+ Selection In Jelly 12X100g,https://www.tesco.com/groceries/en-GB/shop/pets/all?brand=Cesar&viewAll=brand&page=
307742821,Cesar Garden Terrine 8 X 150G,https://www.tesco.com/groceries/en-GB/shop/pets/all?brand=Cesar&viewAll=brand&page=
305048932,Cesar Selection In Sauce 1200G,https://www.tesco.com/groceries/en-GB/shop/pets/all?brand=Cesar&viewAll=brand&page=
305043776,Cesar Selection In Jelly 1200G,https://www.tesco.com/groceries/en-GB/shop/pets/all?brand=Cesar&viewAll=brand&page=
308854606,Cesar Dog Food Chicken Sweet Potato Peas & Cranberry 400G,https://www.tesco.com/groceries/en-GB/shop/pets/all?brand=Cesar&viewAll=brand&page=
308867332,Cesar Dog Food Beef Carrots & Green Beans 400G,https://www.tesco.com/groceries/en-GB/shop/pets/all?brand=Cesar&viewAll=brand&page=
308864639,Cesar Natural Goodness Dogfood Mixed Selection 6X400g,https://www.tesco.com/groceries/en-GB/shop/pets/all?brand=Cesar&viewAll=brand&page=
295410167,Dentalife Daily Oral Care Small 115G,https://www.tesco.com/groceries/en-GB/shop/pets/all?brand=Dentalife&viewAll=brand&page=
295410121,Dentalife Daily Oral Care Medium 115G,https://www.tesco.com/groceries/en-GB/shop/pets/all?brand=Dentalife&viewAll=brand&page=
295410081,Dentalife Daily Oral Care Large 142G,https://www.tesco.com/groceries/en-GB/shop/pets/all?brand=Dentalife&viewAll=brand&page=
303205599,Purina Dentalife Cat Dental Chew Chicken 40G,https://www.tesco.com/groceries/en-GB/shop/pets/all?brand=Dentalife&viewAll=brand&page=
303205617,Purina Dentalife Cat Dental Chew Salmon 40G,https://www.tesco.com/groceries/en-GB/shop/pets/all?brand=Dentalife&viewAll=brand&page=
307050862,Purina Dentalife Medium Dog Chews 24 Sticks 552G,https://www.tesco.com/groceries/en-GB/shop/pets/all?brand=Dentalife&viewAll=brand&page=
307050931,Purina Dentalife Small Dog Chews 30 Sticks 490G,https://www.tesco.com/groceries/en-GB/shop/pets/all?brand=Dentalife&viewAll=brand&page=
